{
  "version": 5,
  "processingId": "5b1f3c2d-7a4e-4f6b-9c8d-1e2f3a4b5c6d",
  "fileId": "9e8d7c6b-5a4f-4e3d-8c2b-1a0f9e8d7c6b",
  "condominiumId": "6f1d2c1e-3b4a-4c8e-9a51-2815a0000001",
  "status": "COMPLETED",
  "reason": null,
  "parser": "po-planilha-apoio",
  "pages": 0,
  "cashFlow": null,
  "budget": null,
  "budgetLineOrigins": {
    "sheet": "PO-26-27",
    "expensesSheet": "despesas-25-26",
    "indexSheet": "dissidio-impostos",
    "lines": [
      {
        "sequence": 24,
        "row": 30,
        "printedCode": "2010-01-03T00:00:00",
        "account": "1692 - Vigia e Portaria",
        "description": "Join Facilities Ltda",
        "sourceAccounts": [
          "1692"
        ],
        "averageFrom": "2026-01",
        "averageTo": "2026-04",
        "averageAmount": "74627.40",
        "baseAmount": "74627.40",
        "method": "AVERAGE_TIMES_INDEX",
        "indexName": "VIGILANTES RJ",
        "indexRate": "0.0723",
        "indexForecast": false,
        "indexNote": null,
        "finalAmount": "80022.96",
        "reason": "Média jan 26/abr 26 + VIGILANTES RJ"
      },
      {
        "sequence": 22,
        "row": 28,
        "printedCode": "1.3.8",
        "account": "1690 - Jardinagem",
        "description": "3JF Facilities Jardinagen, Paisagismo & Serviço Ltda",
        "sourceAccounts": [
          "1690"
        ],
        "averageFrom": "2026-01",
        "averageTo": "2026-04",
        "averageAmount": "13480.00",
        "baseAmount": "13480.00",
        "method": "TYPED",
        "indexName": null,
        "indexRate": null,
        "indexForecast": false,
        "indexNote": null,
        "finalAmount": "18000.00",
        "reason": "Negociação contratual"
      }
    ],
    "accounts": [
      {
        "code": "1545",
        "name": "Verbas Salariais",
        "row": 3,
        "parentCode": null
      },
      {
        "code": "1546",
        "name": "Salário",
        "row": 4,
        "parentCode": "1545"
      },
      {
        "code": "1547",
        "name": "Adiantamento Quinzenal",
        "row": 5,
        "parentCode": "1545"
      },
      {
        "code": "1692",
        "name": "Vigia e Portaria",
        "row": 95,
        "parentCode": null
      }
    ]
  },
  "totalsChecks": [
    {
      "code": "SUPPORT_SHEET_LINES",
      "description": "Linhas de despesa da planilha de apoio",
      "ok": true,
      "detail": "86 linhas lidas"
    }
  ]
}
